{
  "$schema": "../../schema/claims-audit.v0.1.schema.json",
  "schemaVersion": 1,
  "contract": "cartograph.claims-audit",
  "mediaType": "application/vnd.cartograph.claims-audit+json",
  "auditId": "claims-audit-year1-3-v0.1",
  "asOf": "2026-08-25T15:45:00Z",
  "scope": {
    "years": [1, 2, 3],
    "materialClaimRule": "roadmap exit-gates and strategy-decision assertions",
    "network": false,
    "sourceBodiesIncluded": false,
    "privateDataIncluded": false,
    "collectionMode": "local-repository-evidence-only",
    "retention": "claims-and-digests-only"
  },
  "sourceInventory": [
    "docs/ROADMAP.md",
    "docs/EVALUATION.md",
    "docs/THREAT_MODEL.md",
    "docs/SUPPORT_MATRIX.md",
    "docs/ACTION.md",
    "test/action/action.test.ts",
    "test/core/graph-diff.test.ts",
    "test/core/identity-quality.test.ts",
    "test/core/policy-regression.test.ts",
    "action.yml",
    "docs/RELEASE.md",
    "docs/RELEASE_REHEARSAL.md",
    "test/fixtures/typescript-express/expected.json",
    "test/fixtures/snapshots/graph-diff/expected.json",
    "docs/COMPATIBILITY_REVIEW.md",
    "test/fixtures/compatibility-review/scenarios.v0.1.json",
    "docs/IDENTITY_QUALITY.md",
    "test/fixtures/identity-corpus/quality-baseline.v0.1.json",
    "docs/POLICIES.md",
    "test/fixtures/policy-regression.v0.1.json",
    "docs/ADR_REFERENCES.md",
    "docs/adr/0007-local-first-investment-boundary.md",
    "docs/ADAPTERS.md",
    "docs/ADAPTER_SELECTION.md",
    "test/core/adapter-isolation.test.ts",
    "docs/LANGUAGE_EXPANSION_GATE.md",
    "docs/adr/0006-language-expansion-gate.md",
    "docs/LANGUAGE_NEUTRAL_SEMANTICS.md",
    "test/fixtures/language-expansion-gate/report.v0.1.json",
    "docs/RUNTIME_RECONCILIATION.md",
    "docs/RUNTIME_RECONCILIATION_UNCERTAINTY.md",
    "test/fixtures/runtime-reconciliation-corpus/scenarios.v0.1.json",
    "test/fixtures/runtime-reconciliation-reproducibility/study.v0.1.json",
    "docs/COMMUNITY_FEEDBACK.md",
    "test/fixtures/community-feedback/summary.v0.1.json",
    "docs/STRATEGY_PRIVACY_SECURITY_REVIEW.md",
    "test/fixtures/strategy-security/review.v0.1.json",
    "docs/OSS_HEALTH_SCORECARD.md",
    "test/fixtures/oss-health/scorecard.v0.1.json",
    "docs/MAINTENANCE.md",
    "docs/UPGRADING.md"
  ],
  "claims": [
    {
      "id": "y1-capability-graph",
      "year": 1,
      "category": "capability",
      "statement": "The bounded TypeScript and Express slice produces deterministic graphs with source-bound evidence.",
      "status": "verified",
      "finding": "The declared fixture corpus and local analyzer tests pass for the supported graph slice.",
      "evidence": [
        {
          "path": "docs/EVALUATION.md",
          "kind": "document",
          "command": "npm run check",
          "locator": "Fixture corpus, deterministic serialization, and supported construct boundary."
        },
        {
          "path": "test/fixtures/typescript-express/expected.json",
          "kind": "fixture",
          "command": "npm run fixtures:validate",
          "locator": "Expected TypeScript/Express graph and evidence contract."
        },
        {
          "path": "docs/SUPPORT_MATRIX.md",
          "kind": "document",
          "command": "npm run support:validate",
          "locator": "Public supported slice and explicit unsupported boundary."
        }
      ],
      "limitations": [
        "This is a bounded construct claim, not completeness for arbitrary TypeScript."
      ],
      "feedsYear4": []
    },
    {
      "id": "y1-capability-diff",
      "year": 1,
      "category": "capability",
      "statement": "The local workflow compares revisions with evidence-backed semantic diff categories and deterministic reports.",
      "status": "verified",
      "finding": "Golden graph-diff and report tests pass, including conservative unresolved and ambiguity behavior.",
      "evidence": [
        {
          "path": "docs/EVALUATION.md",
          "kind": "document",
          "command": "npx vitest run test/core/graph-diff.test.ts",
          "locator": "Diff evaluation, mutation fixtures, identity, and impact traversal."
        },
        {
          "path": "test/fixtures/snapshots/graph-diff/expected.json",
          "kind": "fixture",
          "command": "npx vitest run test/core/graph-diff.test.ts",
          "locator": "Golden semantic diff categories and evidence."
        }
      ],
      "limitations": [
        "The report is local and bounded by the documented input, cardinality, and time ceilings."
      ],
      "feedsYear4": []
    },
    {
      "id": "y1-capability-action",
      "year": 1,
      "category": "capability",
      "statement": "The read-only GitHub Action provides a fork-safe architecture review boundary.",
      "status": "partial",
      "finding": "The checked-in workflow and local security harness enforce read-only permissions, no secrets, pinned actions, and no repository-code execution; hosted Action fixture jobs currently fail before analysis because generated dist/cli.js is absent.",
      "evidence": [
        {
          "path": "docs/ACTION.md",
          "kind": "document",
          "command": "npm run action:security:validate",
          "locator": "Fork permissions, artifact boundary, policy modes, and local-only behavior."
        },
        {
          "path": "action.yml",
          "kind": "schema",
          "command": "npm run action:validate",
          "locator": "Action inputs and report contract."
        },
        {
          "path": "test/action/action.test.ts",
          "kind": "test",
          "command": "npm run action:validate",
          "locator": "Local Action fixture and security assertions."
        }
      ],
      "limitations": [
        "Hosted matrix execution is not green until the generated CLI artifact path is corrected; local validation is not a hosted pass claim."
      ],
      "feedsYear4": ["year4-correctness-scale"]
    },
    {
      "id": "y1-capability-distribution",
      "year": 1,
      "category": "capability",
      "statement": "The project has a reproducible v0.1 distribution and rollback rehearsal path.",
      "status": "partial",
      "finding": "Local package, SBOM, provenance, quickstart, and installed-CLI rehearsals pass, but no public package release series exists.",
      "evidence": [
        {
          "path": "docs/RELEASE.md",
          "kind": "document",
          "command": "npm run release:validate",
          "locator": "Release artifact and local smoke gate."
        },
        {
          "path": "docs/RELEASE_REHEARSAL.md",
          "kind": "document",
          "command": "npm run quickstart:validate",
          "locator": "Package-install and CLI rollback rehearsal."
        }
      ],
      "limitations": [
        "A local rehearsal does not establish public release stability, downloads, or downstream compatibility."
      ],
      "feedsYear4": ["year4-replication-stewardship"]
    },
    {
      "id": "y1-quality-fixture-thresholds",
      "year": 1,
      "category": "quality",
      "statement": "Explicitly supported construct fixtures meet the declared precision, recall, and evidence completeness targets.",
      "status": "verified",
      "finding": "The local evaluation gate reports the declared supported-slice thresholds and fails on unexpected fixture drift.",
      "evidence": [
        {
          "path": "docs/EVALUATION.md",
          "kind": "document",
          "command": "npm run check",
          "locator": "Precision/recall targets and evidence completeness rule."
        },
        {
          "path": "test/fixtures/typescript-express/expected.json",
          "kind": "fixture",
          "command": "npm run test:coverage",
          "locator": "Curated expected graph records."
        }
      ],
      "limitations": [
        "The threshold applies only to explicitly supported fixture families and is not a population-wide accuracy estimate."
      ],
      "feedsYear4": []
    },
    {
      "id": "y1-quality-unsupported-diagnostics",
      "year": 1,
      "category": "quality",
      "statement": "Unsupported and unresolved constructs remain explicit diagnostics rather than guessed edges.",
      "status": "verified",
      "finding": "Negative fixtures and support-matrix validators preserve explicit unsupported diagnostics with evidence and remediation guidance.",
      "evidence": [
        {
          "path": "docs/SUPPORT_MATRIX.md",
          "kind": "document",
          "command": "npm run support:validate",
          "locator": "Unsupported and unresolved behavior policy."
        },
        {
          "path": "docs/EVALUATION.md",
          "kind": "document",
          "command": "npm run property:validate",
          "locator": "Negative cases, diagnostics, and conservative identity behavior."
        }
      ],
      "limitations": [
        "A diagnostic is evidence of an unsupported boundary, not evidence that an equivalent relationship was recovered."
      ],
      "feedsYear4": []
    },
    {
      "id": "y1-privacy-local-boundary",
      "year": 1,
      "category": "privacy",
      "statement": "The core analyzer can operate locally without source upload, hidden telemetry, or a required network path.",
      "status": "verified",
      "finding": "Threat-model, CLI, Action, and fixture contracts keep source bodies, credentials, background collection, and hosted analysis outside the accepted boundary.",
      "evidence": [
        {
          "path": "docs/THREAT_MODEL.md",
          "kind": "document",
          "command": "npm run check",
          "locator": "Threat boundary and accepted residual risks."
        },
        {
          "path": "docs/STRATEGY_PRIVACY_SECURITY_REVIEW.md",
          "kind": "document",
          "command": "npm run strategy-security:validate",
          "locator": "M-009 local-first decision and data-flow scope."
        },
        {